link,link-href,linked,linked-href,pagination,pagination-href
"","","Dell mouse notebook desktop computer wired mouse USB game office
mouse MS111","https://www.lazada.com.my/dell-mouse-notebook-desktop-computer-wired-mouse-usb-game-officemouse-ms111-87161168.html?ff=1&sc=IYsE","5","https://www.lazada.com.my/taobao-collection/?page=5&sc=IYsE"
"","","Yuan BENSE.O basique 2017 spring New style bottoming shirt men's
high collar hedging long-sleeved t-shirt modal tide (White)","https://www.lazada.com.my/yuan-benseo-basique-2017-spring-new-style-bottoming-shirt-menshigh-collar-hedging-long-sleeved-t-shirt-modal-tide-white-45213485.html?ff=1&sc=IYsE","4","https://www.lazada.com.my/taobao-collection/?page=4&sc=IYsE"
"","","Victory Victor sword full carbon Light Single badminton racket","https://www.lazada.com.my/victory-victor-sword-full-carbon-light-single-badminton-racket-46263066.html?ff=1&sc=IYsE","32959","https://www.lazada.com.my/taobao-collection/?page=32959&sc=IYsE"
"","","Korean-style solid spring and elastic waist wide leg pants","https://www.lazada.com.my/korean-style-solid-spring-and-elastic-waist-wide-leg-pants-40956105.html?ff=1&sc=IYsE","1","https://www.lazada.com.my/taobao-collection/?sc=IYsE"
"","","Cat cage three layer double four layer cat Villa large folding
encryption cat cage small cat Long cat pet cage","https://www.lazada.com.my/cat-cage-three-layer-double-four-layer-cat-villa-large-foldingencryption-cat-cage-small-cat-long-cat-pet-cage-87141296.html?ff=1&sc=IYsE","1","https://www.lazada.com.my/taobao-collection/?sc=IYsE"
"","","Long 50 wide 30 kitchen floor shelving rack storage microwave Rack
does not rust steel color multi-purpose seasoning rack shelf","https://www.lazada.com.my/long-50-wide-30-kitchen-floor-shelving-rack-storage-microwave-rackdoes-not-rust-steel-color-multi-purpose-seasoning-rack-shelf-82654518.html?ff=1&sc=IYsE","1","https://www.lazada.com.my/taobao-collection/?sc=IYsE"
"","","Diana Korean-style color Slim fit long-sleeved small suit jacket (Black) (Black)","https://www.lazada.com.my/diana-korean-style-color-slim-fit-long-sleeved-small-suit-jacket-black-black-63309620.html?ff=1&sc=IYsE","3","https://www.lazada.com.my/taobao-collection/?page=3&sc=IYsE"
"","","Bright Chinese gold bride wedding toast clothing wedding dress","https://www.lazada.com.my/bright-chinese-gold-bride-wedding-toast-clothing-wedding-dress-63316816.html?ff=1&sc=IYsE","32959","https://www.lazada.com.my/taobao-collection/?page=32959&sc=IYsE"
"","","Kitchen is boil pill pot meatballs shrimp balls processing spoon meat","https://www.lazada.com.my/kitchen-is-boil-pill-pot-meatballs-shrimp-balls-processing-spoon-meat-39677925.html?ff=1&sc=IYsE","2","https://www.lazada.com.my/taobao-collection/?page=2&sc=IYsE"
"","","Sports shoes female Korean-style ulzzang Harajuku wild New style breathable mesh student casual running travel shoes (Pink color)","https://www.lazada.com.my/sports-shoes-female-korean-style-ulzzang-harajuku-wild-new-style-breathable-mesh-student-casual-running-travel-shoes-pink-color-73937928.html?ff=1&sc=IYsE","3","https://www.lazada.com.my/taobao-collection/?page=3&sc=IYsE"
"","","Kitchen Fresh film rack cabinet roll holder towel rack cloth hook
Japanese-style bathroom wardrobe storage rack","https://www.lazada.com.my/kitchen-fresh-film-rack-cabinet-roll-holder-towel-rack-cloth-hookjapanese-style-bathroom-wardrobe-storage-rack-91092674.html?ff=1&sc=IYsE","2","https://www.lazada.com.my/taobao-collection/?page=2&sc=IYsE"
"","","Fuji instax DIY frame stickers/cartoon frame stickers Li beat was
paper the stickers","https://www.lazada.com.my/fuji-instax-diy-frame-stickerscartoon-frame-stickers-li-beat-waspaper-the-stickers-41651552.html?ff=1&sc=IYsE","32959","https://www.lazada.com.my/taobao-collection/?page=32959&sc=IYsE"
"","","Simple Solid color bedroom living room blackout curtains half-curtain","https://www.lazada.com.my/simple-solid-color-bedroom-living-room-blackout-curtains-half-curtain-58168476.html?ff=1&sc=IYsE","1","https://www.lazada.com.my/taobao-collection/?sc=IYsE"
"","","Cotton Old coarse plaid bed alone double student sheets single
piece dormitory 1.5/1.8","https://www.lazada.com.my/cotton-old-coarse-plaid-bed-alone-double-student-sheets-singlepiece-dormitory-1518-75325526.html?ff=1&sc=IYsE","2","https://www.lazada.com.my/taobao-collection/?page=2&sc=IYsE"
"","","Children's Early Childhood cognitive knowledge map material 26, English letters card baby ENLIGHTEN Yi Zhi learning toys 1-3-year-old","https://www.lazada.com.my/children39s-early-childhood-cognitive-knowledge-map-material-26-english-letters-card-baby-enlighten-yi-zhi-learning-toys-1-3-year-old-41820374.html?ff=1&sc=IYsE","1","https://www.lazada.com.my/taobao-collection/?sc=IYsE"
"","","Children's Early Childhood cognitive knowledge map material 26, English letters card baby ENLIGHTEN Yi Zhi learning toys 1-3-year-old","https://www.lazada.com.my/children39s-early-childhood-cognitive-knowledge-map-material-26-english-letters-card-baby-enlighten-yi-zhi-learning-toys-1-3-year-old-41820374.html?ff=1&sc=IYsE","",""
"","","Children math early childhood writing board box","https://www.lazada.com.my/children-math-early-childhood-writing-board-box-52275014.html?ff=1&sc=IYsE","5","https://www.lazada.com.my/taobao-collection/?page=5&sc=IYsE"
"","","Stainless steel can be retractable under the sink shelf microwave
oven kitchen shelf storage rack shoe rack pot rack shelf","https://www.lazada.com.my/stainless-steel-can-be-retractable-under-the-sink-shelf-microwaveoven-kitchen-shelf-storage-rack-shoe-rack-pot-rack-shelf-91011170.html?ff=1&sc=IYsE","2","https://www.lazada.com.my/taobao-collection/?page=2&sc=IYsE"
"","","Caught cabinet drawer storage cabinets plastic gap narrow cabinet
finishing storage cabinet caught storage cabinet gap Cabinet","https://www.lazada.com.my/caught-cabinet-drawer-storage-cabinets-plastic-gap-narrow-cabinetfinishing-storage-cabinet-caught-storage-cabinet-gap-cabinet-82600016.html?ff=1&sc=IYsE","3","https://www.lazada.com.my/taobao-collection/?page=3&sc=IYsE"
"","","Female tide New style summer student rivet shoulder bag","https://www.lazada.com.my/female-tide-new-style-summer-student-rivet-shoulder-bag-70422883.html?ff=1&sc=IYsE","4","https://www.lazada.com.my/taobao-collection/?page=4&sc=IYsE"
"","","2016 new arrival women's handbag shoulder bag backpack schoolbag korean version of the trend of fashion leather travel backpack multifunctional","https://www.lazada.com.my/2016-new-arrival-women39s-handbag-shoulder-bag-backpack-schoolbag-korean-version-of-the-trend-of-fashion-leather-travel-backpack-multifunctional-40025711.html?ff=1&sc=IYsE","1","https://www.lazada.com.my/taobao-collection/?sc=IYsE"
"","","Handbag 2017 New style Korean-style tide wild shoulder bag fashion handbag flow Su Xiaofang bag messenger bag small bag (Black)","https://www.lazada.com.my/handbag-2017-new-style-korean-style-tide-wild-shoulder-bag-fashion-handbag-flow-su-xiaofang-bag-messenger-bag-small-bag-black-45946923.html?ff=1&sc=IYsE","4","https://www.lazada.com.my/taobao-collection/?page=4&sc=IYsE"
"","","Teaching with thirteen hole early childhood shape educational toys
building blocks","https://www.lazada.com.my/teaching-with-thirteen-hole-early-childhood-shape-educational-toysbuilding-blocks-59116082.html?ff=1&sc=IYsE","5","https://www.lazada.com.my/taobao-collection/?page=5&sc=IYsE"
"","","LR Old Beijing breathable mesh shoes men's casual shoes (Gray) (Gray)","https://www.lazada.com.my/lr-old-beijing-breathable-mesh-shoes-men39s-casual-shoes-gray-gray-66689505.html?ff=1&sc=IYsE","2","https://www.lazada.com.my/taobao-collection/?page=2&sc=IYsE"
"","","Leather Snowy moon cake hand pressure-home mooncake Mold","https://www.lazada.com.my/leather-snowy-moon-cake-hand-pressure-home-mooncake-mold-101842296.html?ff=1&sc=IYsE","4","https://www.lazada.com.my/taobao-collection/?page=4&sc=IYsE"
"","","Autumn dress female 2017 New style Top long-sleeved t-shirt female
gauze letter Print hollow chic bottoming shirt female outer wear
(158 * white)","https://www.lazada.com.my/autumn-dress-female-2017-new-style-top-long-sleeved-t-shirt-femalegauze-letter-print-hollow-chic-bottoming-shirt-female-outer-wear158-white-81108709.html?ff=1&sc=IYsE","2","https://www.lazada.com.my/taobao-collection/?page=2&sc=IYsE"
"","","US life large explosion bear 1.6 m plush toy teddy bear doll large bear hug birthday gift","https://www.lazada.com.my/us-life-large-explosion-bear-16-m-plush-toy-teddy-bear-doll-large-bear-hug-birthday-gift-64676804.html?ff=1&sc=IYsE","4","https://www.lazada.com.my/taobao-collection/?page=4&sc=IYsE"
"","","Fall Fashion shoes New style casual shoes (The NEW d-2 black)","https://www.lazada.com.my/fall-fashion-shoes-new-style-casual-shoes-the-new-d-2-black-51227265.html?ff=1&sc=IYsE","1","https://www.lazada.com.my/taobao-collection/?sc=IYsE"
"","","Foreign trade clothing store non-slip straps-seamless color hanger","https://www.lazada.com.my/foreign-trade-clothing-store-non-slip-straps-seamless-color-hanger-43153629.html?ff=1&sc=IYsE","32959","https://www.lazada.com.my/taobao-collection/?page=32959&sc=IYsE"
"","","Simple in the flat with heavy-bottomed sandals (White) (White)","https://www.lazada.com.my/simple-in-the-flat-with-heavy-bottomed-sandals-white-white-51223802.html?ff=1&sc=IYsE","3","https://www.lazada.com.my/taobao-collection/?page=3&sc=IYsE"
"","","10, dress Wood Slip hanger seamless wood hangers wooden hotel
hanger retro clothing store hanger garment support","https://www.lazada.com.my/10-dress-wood-slip-hanger-seamless-wood-hangers-wooden-hotelhanger-retro-clothing-store-hanger-garment-support-62170180.html?ff=1&sc=IYsE","5","https://www.lazada.com.my/taobao-collection/?page=5&sc=IYsE"
"","","Spring and Autumn men and women hotel seven points long-sleeved
double-sided cotton towel material long Plus-sized robe bathrobe","https://www.lazada.com.my/spring-and-autumn-men-and-women-hotel-seven-points-long-sleeveddouble-sided-cotton-towel-material-long-plus-sized-robe-bathrobe-79577938.html?ff=1&sc=IYsE","3","https://www.lazada.com.my/taobao-collection/?page=3&sc=IYsE"
"","","Korean-style spring new loose white shirt","https://www.lazada.com.my/korean-style-spring-new-loose-white-shirt-40906501.html?ff=1&sc=IYsE","2","https://www.lazada.com.my/taobao-collection/?page=2&sc=IYsE"
"","","Applicable New style Fujifilm XT10 X100 X100S/T X10 X20 XA2 micro
single camera shoulder","https://www.lazada.com.my/applicable-new-style-fujifilm-xt10-x100-x100st-x10-x20-xa2-microsingle-camera-shoulder-87111753.html?ff=1&sc=IYsE","32959","https://www.lazada.com.my/taobao-collection/?page=32959&sc=IYsE"
"","","English ENLIGHTEN color word card English flash cards large card
fruit class 24 Zhang English children teacher teaching","https://www.lazada.com.my/english-enlighten-color-word-card-english-flash-cards-large-cardfruit-class-24-zhang-english-children-teacher-teaching-41905422.html?ff=1&sc=IYsE","2","https://www.lazada.com.my/taobao-collection/?page=2&sc=IYsE"
"","","Gelert camping quick-drying outdoor comes with storage bag","https://www.lazada.com.my/gelert-camping-quick-drying-outdoor-comes-with-storage-bag-39851616.html?ff=1&sc=IYsE","2","https://www.lazada.com.my/taobao-collection/?page=2&sc=IYsE"
"","","Bathroom bathroom shelf desktop makeup products storage rack wash station supplies finishing rack drawer storage box","https://www.lazada.com.my/bathroom-bathroom-shelf-desktop-makeup-products-storage-rack-wash-station-supplies-finishing-rack-drawer-storage-box-81104356.html?ff=1&sc=IYsE","3","https://www.lazada.com.my/taobao-collection/?page=3&sc=IYsE"
"","","Waterproof environmentally friendly odorless toilet rack bathroom shelf","https://www.lazada.com.my/waterproof-environmentally-friendly-odorless-toilet-rack-bathroom-shelf-98933524.html?ff=1&sc=IYsE","4","https://www.lazada.com.my/taobao-collection/?page=4&sc=IYsE"
"","","Wooden clock wooden pairing toys digital shape building blocks","https://www.lazada.com.my/wooden-clock-wooden-pairing-toys-digital-shape-building-blocks-39917625.html?ff=1&sc=IYsE","4","https://www.lazada.com.my/taobao-collection/?page=4&sc=IYsE"
"","","Hot wheels small sports car","https://www.lazada.com.my/hot-wheels-small-sports-car-59011703.html?ff=1&sc=IYsE","32959","https://www.lazada.com.my/taobao-collection/?page=32959&sc=IYsE"
"","","Wind Tour tent outdoor 3-4 people full automatic two room A Hall 2
people outdoor camping beach tent set","https://www.lazada.com.my/wind-tour-tent-outdoor-3-4-people-full-automatic-two-room-a-hall-2people-outdoor-camping-beach-tent-set-73795826.html?ff=1&sc=IYsE","2","https://www.lazada.com.my/taobao-collection/?page=2&sc=IYsE"
"","","Multi-layer stainless steel home S-shaped pants folder pants rack","https://www.lazada.com.my/multi-layer-stainless-steel-home-s-shaped-pants-folder-pants-rack-62021778.html?ff=1&sc=IYsE","5","https://www.lazada.com.my/taobao-collection/?page=5&sc=IYsE"
"","","Teddy bear doll plush toy birthday gift pillow","https://www.lazada.com.my/teddy-bear-doll-plush-toy-birthday-gift-pillow-64662515.html?ff=1&sc=IYsE","5","https://www.lazada.com.my/taobao-collection/?page=5&sc=IYsE"
"","","Female handbag tide Oxford Cloth rivet nylon canvas shoulder bag","https://www.lazada.com.my/female-handbag-tide-oxford-cloth-rivet-nylon-canvas-shoulder-bag-45806230.html?ff=1&sc=IYsE","4","https://www.lazada.com.my/taobao-collection/?page=4&sc=IYsE"
"","","Blue Lily storage basket iron basket egg basket potato garlic
container ornaments egg hollow container basket","https://www.lazada.com.my/blue-lily-storage-basket-iron-basket-egg-basket-potato-garliccontainer-ornaments-egg-hollow-container-basket-77479762.html?ff=1&sc=IYsE","3","https://www.lazada.com.my/taobao-collection/?page=3&sc=IYsE"
"","","XD adult split electric car outdoor Oxford Cloth raincoat (Black)","https://www.lazada.com.my/xd-adult-split-electric-car-outdoor-oxford-cloth-raincoat-black-39823086.html?ff=1&sc=IYsE","5","https://www.lazada.com.my/taobao-collection/?page=5&sc=IYsE"
"","","Korean spring New style hit color cardigan jacket (White)","https://www.lazada.com.my/korean-spring-new-style-hit-color-cardigan-jacket-white-40906618.html?ff=1&sc=IYsE","1","https://www.lazada.com.my/taobao-collection/?sc=IYsE"
"","","Color Diana Slim fit short-sleeved chiffon Shirt shirt bottoming shirt (Sky blue) (Sky blue)","https://www.lazada.com.my/color-diana-slim-fit-short-sleeved-chiffon-shirt-shirt-bottoming-shirt-sky-blue-sky-blue-47356519.html?ff=1&sc=IYsE","5","https://www.lazada.com.my/taobao-collection/?page=5&sc=IYsE"
"","","Creative half transparent hanging Hanging Kitchen Storage Bag","https://www.lazada.com.my/creative-half-transparent-hanging-hanging-kitchen-storage-bag-58996778.html?ff=1&sc=IYsE","5","https://www.lazada.com.my/taobao-collection/?page=5&sc=IYsE"
"","","Shelving rack microwave oven rack storage rack shelf kitchen
supplies room","https://www.lazada.com.my/shelving-rack-microwave-oven-rack-storage-rack-shelf-kitchensupplies-room-90687507.html?ff=1&sc=IYsE","",""
"","","Zhu Yun USB charging student dormitory portable-with a clip fan
baby car small fan bed dual","https://www.lazada.com.my/zhu-yun-usb-charging-student-dormitory-portable-with-a-clip-fanbaby-car-small-fan-bed-dual-52039358.html?ff=1&sc=IYsE","32959","https://www.lazada.com.my/taobao-collection/?page=32959&sc=IYsE"
"","","Canon eos m 2 m3 EOS M10 g7x g15 g16 camera bag Leather","https://www.lazada.com.my/canon-eos-m-2-m3-eos-m10-g7x-g15-g16-camera-bag-leather-87122899.html?ff=1&sc=IYsE","4","https://www.lazada.com.my/taobao-collection/?page=4&sc=IYsE"
"","","2017 autumn dress Korean ulzzang Harajuku BF wind loose striped
stitching long-sleeved Top T-shirt student hoodie women","https://www.lazada.com.my/2017-autumn-dress-korean-ulzzang-harajuku-bf-wind-loose-stripedstitching-long-sleeved-top-t-shirt-student-hoodie-women-81138015.html?ff=1&sc=IYsE","2","https://www.lazada.com.my/taobao-collection/?page=2&sc=IYsE"
"","","Color Diana New style Slim fit Korean-style solid color short-sleeved chiffon shirt","https://www.lazada.com.my/color-diana-new-style-slim-fit-korean-style-solid-color-short-sleeved-chiffon-shirt-47380298.html?ff=1&sc=IYsE","",""
"","","Kitchen can be superimposed wrought iron shelf wardrobe storage rack layered storage rack dormitory cabinet hanging basket finishing rack","https://www.lazada.com.my/kitchen-can-be-superimposed-wrought-iron-shelf-wardrobe-storage-rack-layered-storage-rack-dormitory-cabinet-hanging-basket-finishing-rack-81099375.html?ff=1&sc=IYsE","5","https://www.lazada.com.my/taobao-collection/?page=5&sc=IYsE"
"","","Girl is foot piano newborn children, 0-1 years old toys","https://www.lazada.com.my/girl-is-foot-piano-newborn-children-0-1-years-old-toys-50865617.html?ff=1&sc=IYsE","1","https://www.lazada.com.my/taobao-collection/?sc=IYsE"
"","","Female shoes New style heavy-bottomed student breathable lace white
shoes (Platinum) (Platinum)","https://www.lazada.com.my/female-shoes-new-style-heavy-bottomed-student-breathable-lace-whiteshoes-platinum-platinum-51217816.html?ff=1&sc=IYsE","1","https://www.lazada.com.my/taobao-collection/?sc=IYsE"
"","","Snow Australia swimming pool electric pump pumping suction pump
inflatable Pump","https://www.lazada.com.my/snow-australia-swimming-pool-electric-pump-pumping-suction-pumpinflatable-pump-52635905.html?ff=1&sc=IYsE","4","https://www.lazada.com.my/taobao-collection/?page=4&sc=IYsE"
"","","Spring and Autumn and autumn New style Korean-style pointed
Butterfly knot gray suede shallow mouth in with thick with single
shoes women high-heeled shoes (Blue-nude models)","https://www.lazada.com.my/spring-and-autumn-and-autumn-new-style-korean-style-pointedbutterfly-knot-gray-suede-shallow-mouth-in-with-thick-with-singleshoes-women-high-heeled-shoes-blue-nude-models-83109566.html?ff=1&sc=IYsE","5","https://www.lazada.com.my/taobao-collection/?page=5&sc=IYsE"
"","","Couple shoes 2017 New style Korean-style fashion wild casual shoes
Hong Kong style breathable running shoes street shooting sports
shoes Female Summer (Black)","https://www.lazada.com.my/couple-shoes-2017-new-style-korean-style-fashion-wild-casual-shoeshong-kong-style-breathable-running-shoes-street-shooting-sportsshoes-female-summer-black-81108164.html?ff=1&sc=IYsE","1","https://www.lazada.com.my/taobao-collection/?sc=IYsE"
"","","Commuter New style picture bucket bag (Black) (Black)","https://www.lazada.com.my/commuter-new-style-picture-bucket-bag-black-black-47377707.html?ff=1&sc=IYsE","3","https://www.lazada.com.my/taobao-collection/?page=3&sc=IYsE"
"","","Children's Educational toys wooden mini small around the bead cute ENLIGHTEN baby toys 1-2-year-old wood base","https://www.lazada.com.my/children39s-educational-toys-wooden-mini-small-around-the-bead-cute-enlighten-baby-toys-1-2-year-old-wood-base-41797278.html?ff=1&sc=IYsE","5","https://www.lazada.com.my/taobao-collection/?page=5&sc=IYsE"
"","","2017 New style pointed flat shoes female shallow mouth shoes to help low casual shoes scoop shoes Spring and Autumn minimalist Four Seasons shoes (Deep Brown)","https://www.lazada.com.my/2017-new-style-pointed-flat-shoes-female-shallow-mouth-shoes-to-help-low-casual-shoes-scoop-shoes-spring-and-autumn-minimalist-four-seasons-shoes-deep-brown-83235806.html?ff=1&sc=IYsE","",""
"","","Modern geometric living room coffee table full shop big black and
white gray mats","https://www.lazada.com.my/modern-geometric-living-room-coffee-table-full-shop-big-black-andwhite-gray-mats-70897091.html?ff=1&sc=IYsE","",""
"","","2017 New style tide sandals Female Summer flat Korean students wild
Korean-style cute retro muffin bottom in with shoes (Sky blue
color)","https://www.lazada.com.my/2017-new-style-tide-sandals-female-summer-flat-korean-students-wildkorean-style-cute-retro-muffin-bottom-in-with-shoes-sky-bluecolor-67354225.html?ff=1&sc=IYsE","3","https://www.lazada.com.my/taobao-collection/?page=3&sc=IYsE"
"","","Stainless steel bathroom paper towel holder kitchen towel rack","https://www.lazada.com.my/stainless-steel-bathroom-paper-towel-holder-kitchen-towel-rack-98936959.html?ff=1&sc=IYsE","5","https://www.lazada.com.my/taobao-collection/?page=5&sc=IYsE"
"","","Storage rack long 100 wide 50 shelving rack living room floor shelf
4 layer 5 layer 6 layer finishing rack not Stainless steel color
shelf","https://www.lazada.com.my/storage-rack-long-100-wide-50-shelving-rack-living-room-floor-shelf4-layer-5-layer-6-layer-finishing-rack-not-stainless-steel-colorshelf-82584509.html?ff=1&sc=IYsE","2","https://www.lazada.com.my/taobao-collection/?page=2&sc=IYsE"
"","","GONGTING European home luxury tea cup bone china coffee cup","https://www.lazada.com.my/gongting-european-home-luxury-tea-cup-bone-china-coffee-cup-96699560.html?ff=1&sc=IYsE","32959","https://www.lazada.com.my/taobao-collection/?page=32959&sc=IYsE"
"","","Pearl pointed flat shoes Shoes (Silver) (Silver)","https://www.lazada.com.my/pearl-pointed-flat-shoes-shoes-silver-silver-73953039.html?ff=1&sc=IYsE","",""
"","","7@ 6 Summer models Korean-style fashion wild off-the-shoulder
hedging chiffon shirt Women's Stylish Slim fit Top (Brown)","https://www.lazada.com.my/7-6-summer-models-korean-style-fashion-wild-off-the-shoulderhedging-chiffon-shirt-womens-stylish-slim-fit-top-brown-57240745.html?ff=1&sc=IYsE","32959","https://www.lazada.com.my/taobao-collection/?page=32959&sc=IYsE"
"","","Korean models cute cartoon Spider Man pencil Spider-Man pencil HB
students wooden pencil gift","https://www.lazada.com.my/korean-models-cute-cartoon-spider-man-pencil-spider-man-pencil-hbstudents-wooden-pencil-gift-69534595.html?ff=1&sc=IYsE","3","https://www.lazada.com.my/taobao-collection/?page=3&sc=IYsE"
"","","Children learn painting tools baby graffiti coloring fill color
drawing painting template suit children educational toys","https://www.lazada.com.my/children-learn-painting-tools-baby-graffiti-coloring-fill-colordrawing-painting-template-suit-children-educational-toys-50962415.html?ff=1&sc=IYsE","4","https://www.lazada.com.my/taobao-collection/?page=4&sc=IYsE"
"","","Autumn Cool oblique collar long-sleeved female T-shirt loose High
School Students striped stitching Top Han Fan wild bottoming shirt
tide","https://www.lazada.com.my/autumn-cool-oblique-collar-long-sleeved-female-t-shirt-loose-highschool-students-striped-stitching-top-han-fan-wild-bottoming-shirttide-73953557.html?ff=1&sc=IYsE","2","https://www.lazada.com.my/taobao-collection/?page=2&sc=IYsE"
"","","European-style wrought iron wedding road lead stage ornaments candlestick lantern","https://www.lazada.com.my/european-style-wrought-iron-wedding-road-lead-stage-ornaments-candlestick-lantern-60173834.html?ff=1&sc=IYsE","32959","https://www.lazada.com.my/taobao-collection/?page=32959&sc=IYsE"
"","","Pearl pointed flat shoes Shoes (Silver) (Silver)","https://www.lazada.com.my/pearl-pointed-flat-shoes-shoes-silver-silver-73953039.html?ff=1&sc=IYsE","1","https://www.lazada.com.my/taobao-collection/?sc=IYsE"
"","","Security sanitation traffic rain pants reflective raincoat (Navy
blue suit)","https://www.lazada.com.my/security-sanitation-traffic-rain-pants-reflective-raincoat-navyblue-suit-52002586.html?ff=1&sc=IYsE","2","https://www.lazada.com.my/taobao-collection/?page=2&sc=IYsE"
"","","Color Diana 2017 autumn and winter new Korean long-sleeved knit
slim bottoming waist was thin package hip flounced dress","https://www.lazada.com.my/color-diana-2017-autumn-and-winter-new-korean-long-sleeved-knitslim-bottoming-waist-was-thin-package-hip-flounced-dress-81103149.html?ff=1&sc=IYsE","2","https://www.lazada.com.my/taobao-collection/?page=2&sc=IYsE"
"","","Shuangqing wall hangers toothbrush Hanging Box teeth with seat toothbrush rack","https://www.lazada.com.my/shuangqing-wall-hangers-toothbrush-hanging-box-teeth-with-seat-toothbrush-rack-110927418.html?ff=1&sc=IYsE","32959","https://www.lazada.com.my/taobao-collection/?page=32959&sc=IYsE"
"","","Cartoon cute small cat kitchen long carpet non-slip bedroom bed front floor mats absorbent non-slip foot mat","https://www.lazada.com.my/cartoon-cute-small-cat-kitchen-long-carpet-non-slip-bedroom-bed-front-floor-mats-absorbent-non-slip-foot-mat-77541223.html?ff=1&sc=IYsE","3","https://www.lazada.com.my/taobao-collection/?page=3&sc=IYsE"
"","","Storage rack long 60 wide 45 kitchen floor storage rack microwave
oven rack stainless steel color 3 layer 4 layer Finishing rack pot
rack","https://www.lazada.com.my/storage-rack-long-60-wide-45-kitchen-floor-storage-rack-microwaveoven-rack-stainless-steel-color-3-layer-4-layer-finishing-rack-potrack-82611607.html?ff=1&sc=IYsE","2","https://www.lazada.com.my/taobao-collection/?page=2&sc=IYsE"
"","","Early childhood word card daily behavior 27 Zhang Yingwen ENLIGHTEN
teacher teaching with flash card waterproof and durable children's","https://www.lazada.com.my/early-childhood-word-card-daily-behavior-27-zhang-yingwen-enlightenteacher-teaching-with-flash-card-waterproof-and-durable-childrens-41835432.html?ff=1&sc=IYsE","3","https://www.lazada.com.my/taobao-collection/?page=3&sc=IYsE"
"","","Lamaze multi-function music BB device ring paper Caterpillar","https://www.lazada.com.my/lamaze-multi-function-music-bb-device-ring-paper-caterpillar-64579216.html?ff=1&sc=IYsE","4","https://www.lazada.com.my/taobao-collection/?page=4&sc=IYsE"
