link,link-href,linked,linked-href,pagination,pagination-href
"","","Korean-style solid spring and elastic waist wide leg pants","https://www.lazada.com.my/korean-style-solid-spring-and-elastic-waist-wide-leg-pants-40956105.html?ff=1&sc=IYsE","",""
"","","Summer icy sleeves sun protection gloves for men and women Anti-UV thin long ice silk sun protection sleeve sleeves driving arm Sleeve (Black (thumb models))","https://www.lazada.com.my/summer-icy-sleeves-sun-protection-gloves-for-men-and-women-anti-uv-thin-long-ice-silk-sun-protection-sleeve-sleeves-driving-arm-sleeve-black-thumb-models-90562797.html?ff=1&sc=IYsE","32959","https://www.lazada.com.my/taobao-collection/?page=32959&sc=IYsE"
"","","Kitchen three layer multi-function storage rack dish rack","https://www.lazada.com.my/kitchen-three-layer-multi-function-storage-rack-dish-rack-82660746.html?ff=1&sc=IYsE","",""
"","","Men backpack men's bag kangaroo business vertical version messenger
bag","https://www.lazada.com.my/men-backpack-mens-bag-kangaroo-business-vertical-version-messengerbag-70401280.html?ff=1&sc=IYsE","5","https://www.lazada.com.my/taobao-collection/?page=5&sc=IYsE"
"","","Yoga exercise shoes 2017 New style Korean-style breathable casual flat mesh shoes couple sports shoes women running shoes (Pink color)","https://www.lazada.com.my/yoga-exercise-shoes-2017-new-style-korean-style-breathable-casual-flat-mesh-shoes-couple-sports-shoes-women-running-shoes-pink-color-73933767.html?ff=1&sc=IYsE","",""
"","","Couple shoes 2017 New style Korean-style fashion wild casual shoes
Hong Kong style breathable running shoes street shooting sports
shoes Female Summer (Black)","https://www.lazada.com.my/couple-shoes-2017-new-style-korean-style-fashion-wild-casual-shoeshong-kong-style-breathable-running-shoes-street-shooting-sportsshoes-female-summer-black-81108164.html?ff=1&sc=IYsE","",""
"","","Stainless steel drying rack folding outdoor balcony multifunction
hangers towel clothes hanging towel small hanging shoes rack","https://www.lazada.com.my/stainless-steel-drying-rack-folding-outdoor-balcony-multifunctionhangers-towel-clothes-hanging-towel-small-hanging-shoes-rack-42699491.html?ff=1&sc=IYsE","5","https://www.lazada.com.my/taobao-collection/?page=5&sc=IYsE"
"","","MM stitching chiffon female Slimming effect lanterns culottes pants collapse","https://www.lazada.com.my/mm-stitching-chiffon-female-slimming-effect-lanterns-culottes-pants-collapse-40880248.html?ff=1&sc=IYsE","3","https://www.lazada.com.my/taobao-collection/?page=3&sc=IYsE"
"","","Students stationery jingle cats pencil cute cartoon machine cat
wooden pencil school supplies HB 8003","https://www.lazada.com.my/students-stationery-jingle-cats-pencil-cute-cartoon-machine-catwooden-pencil-school-supplies-hb-8003-69412584.html?ff=1&sc=IYsE","3","https://www.lazada.com.my/taobao-collection/?page=3&sc=IYsE"
"","","Long 50 wide 30 kitchen floor shelving rack storage microwave Rack
does not rust steel color multi-purpose seasoning rack shelf","https://www.lazada.com.my/long-50-wide-30-kitchen-floor-shelving-rack-storage-microwave-rackdoes-not-rust-steel-color-multi-purpose-seasoning-rack-shelf-82654518.html?ff=1&sc=IYsE","",""
"","","200 short-sleeved summer T-shirt Plus-sized Women's","https://www.lazada.com.my/200-short-sleeved-summer-t-shirt-plus-sized-women39s-70204988.html?ff=1&sc=IYsE","5","https://www.lazada.com.my/taobao-collection/?page=5&sc=IYsE"
"","","MM spring and summer sleeveless Plus-sized Slimming effect shoulder strap dress denim dress","https://www.lazada.com.my/mm-spring-and-summer-sleeveless-plus-sized-slimming-effect-shoulder-strap-dress-denim-dress-57251311.html?ff=1&sc=IYsE","1","https://www.lazada.com.my/taobao-collection/?sc=IYsE"
"","","Cupboard plastic kitchen drain water dish rack with lid chopsticks
cutlery storage box put dish rack dripping dishes glove rack","https://www.lazada.com.my/cupboard-plastic-kitchen-drain-water-dish-rack-with-lid-chopstickscutlery-storage-box-put-dish-rack-dripping-dishes-glove-rack-82585136.html?ff=1&sc=IYsE","3","https://www.lazada.com.my/taobao-collection/?page=3&sc=IYsE"
"","","Bathroom hand-washing room Double Layer toilet storage rack shelf","https://www.lazada.com.my/bathroom-hand-washing-room-double-layer-toilet-storage-rack-shelf-98460754.html?ff=1&sc=IYsE","3","https://www.lazada.com.my/taobao-collection/?page=3&sc=IYsE"
"","","Spring and Autumn and autumn New style Korean-style breathable
canvas shoes white shoes flat shoes a pedal to help low casual
shoes female shoes (A8 white)","https://www.lazada.com.my/spring-and-autumn-and-autumn-new-style-korean-style-breathablecanvas-shoes-white-shoes-flat-shoes-a-pedal-to-help-low-casualshoes-female-shoes-a8-white-88045164.html?ff=1&sc=IYsE","1","https://www.lazada.com.my/taobao-collection/?sc=IYsE"
"","","Jacquard table skirt conference table skirt wedding table skirts-Welcome area hotel restaurant table skirts sign tables, dress","https://www.lazada.com.my/jacquard-table-skirt-conference-table-skirt-wedding-table-skirts-welcome-area-hotel-restaurant-table-skirts-sign-tables-dress-92228006.html?ff=1&sc=IYsE","4","https://www.lazada.com.my/taobao-collection/?page=4&sc=IYsE"
"","","2016 new arrival women's handbag shoulder bag backpack schoolbag korean version of the trend of fashion leather travel backpack multifunctional","https://www.lazada.com.my/2016-new-arrival-women39s-handbag-shoulder-bag-backpack-schoolbag-korean-version-of-the-trend-of-fashion-leather-travel-backpack-multifunctional-40025711.html?ff=1&sc=IYsE","",""
"","","Screw nut combination disassembly tool sets baby boy children aged
3-4-6 removable toy puzzle hands","https://www.lazada.com.my/screw-nut-combination-disassembly-tool-sets-baby-boy-children-aged3-4-6-removable-toy-puzzle-hands-39916992.html?ff=1&sc=IYsE","1","https://www.lazada.com.my/taobao-collection/?sc=IYsE"
"","","3M 4565 hooded red strip piece breathable protective clothing work
clothes dust chemical warfare suits anti-liquid spray splash","https://www.lazada.com.my/3m-4565-hooded-red-strip-piece-breathable-protective-clothing-workclothes-dust-chemical-warfare-suits-anti-liquid-spray-splash-88021684.html?ff=1&sc=IYsE","32959","https://www.lazada.com.my/taobao-collection/?page=32959&sc=IYsE"
"","","Double bed quilt pillowcase three sheets four sets of Bed Linen","https://www.lazada.com.my/double-bed-quilt-pillowcase-three-sheets-four-sets-of-bed-linen-53615046.html?ff=1&sc=IYsE","4","https://www.lazada.com.my/taobao-collection/?page=4&sc=IYsE"
"","","Air2/ipad4/Pro9/ipad56 APPLE iPad tablet computer liner bag","https://www.lazada.com.my/air2ipad4pro9ipad56-apple-ipad-tablet-computer-liner-bag-41321185.html?ff=1&sc=IYsE","32959","https://www.lazada.com.my/taobao-collection/?page=32959&sc=IYsE"
"","","Fuk wing full of diamond earrings female s925 silver needle
earrings japan and south korea sweet temperament korean simple
earrings","https://www.lazada.com.my/fuk-wing-full-of-diamond-earrings-female-s925-silver-needleearrings-japan-and-south-korea-sweet-temperament-korean-simpleearrings-44991395.html?ff=1&sc=IYsE","3","https://www.lazada.com.my/taobao-collection/?page=3&sc=IYsE"
"","","Liu Tao recommended wash towel beauty salon cotton A-cleansing
towel non-woven cloth beauty facial tissue","https://www.lazada.com.my/liu-tao-recommended-wash-towel-beauty-salon-cotton-a-cleansingtowel-non-woven-cloth-beauty-facial-tissue-75030757.html?ff=1&sc=IYsE","5","https://www.lazada.com.my/taobao-collection/?page=5&sc=IYsE"
"","","Summer New style Korean-style men's short-sleeved shirt tide
popular men's Slim fit Spell color casual shirt thin section Top
tide","https://www.lazada.com.my/summer-new-style-korean-style-mens-short-sleeved-shirt-tidepopular-mens-slim-fit-spell-color-casual-shirt-thin-section-toptide-63289798.html?ff=1&sc=IYsE","2","https://www.lazada.com.my/taobao-collection/?page=2&sc=IYsE"
"","","2017 autumn dress Korean-style New style digital male children's clothing children's fleece hooded hoodie coat wt-0857","https://www.lazada.com.my/2017-autumn-dress-korean-style-new-style-digital-male-children39s-clothing-children39s-fleece-hooded-hoodie-coat-wt-0857-73960106.html?ff=1&sc=IYsE","4","https://www.lazada.com.my/taobao-collection/?page=4&sc=IYsE"
"","","Screw nut combination disassembly tool sets baby boy children aged
3-4-6 removable toy puzzle hands","https://www.lazada.com.my/screw-nut-combination-disassembly-tool-sets-baby-boy-children-aged3-4-6-removable-toy-puzzle-hands-39916992.html?ff=1&sc=IYsE","",""
"","","Floor-towel simple free punch rack bath towel rack","https://www.lazada.com.my/floor-towel-simple-free-punch-rack-bath-towel-rack-47355495.html?ff=1&sc=IYsE","4","https://www.lazada.com.my/taobao-collection/?page=4&sc=IYsE"
"","","A4 sticker blank not sticky laser adhesive stickers printing paper","https://www.lazada.com.my/a4-sticker-blank-not-sticky-laser-adhesive-stickers-printing-paper-40357391.html?ff=1&sc=IYsE","4","https://www.lazada.com.my/taobao-collection/?page=4&sc=IYsE"
"","","Kitchen refrigerator rack side wall rack kitchen storage rack
shelving rack seasoning material rack finishing frame 65827","https://www.lazada.com.my/kitchen-refrigerator-rack-side-wall-rack-kitchen-storage-rackshelving-rack-seasoning-material-rack-finishing-frame-65827-82682085.html?ff=1&sc=IYsE","32959","https://www.lazada.com.my/taobao-collection/?page=32959&sc=IYsE"
"","","MM spring and summer sleeveless Plus-sized Slimming effect shoulder strap dress denim dress","https://www.lazada.com.my/mm-spring-and-summer-sleeveless-plus-sized-slimming-effect-shoulder-strap-dress-denim-dress-57251311.html?ff=1&sc=IYsE","",""
"","","DUSTO Korean-style summer sandals pregnant female student soft
bottom flat with non-slip mom women shoes DW16X8810A","https://www.lazada.com.my/dusto-korean-style-summer-sandals-pregnant-female-student-softbottom-flat-with-non-slip-mom-women-shoes-dw16x8810a-87880035.html?ff=1&sc=IYsE","5","https://www.lazada.com.my/taobao-collection/?page=5&sc=IYsE"
"","","Color Diana 2017 autumn and winter new Korean version of Women's
butterfly knot Slim was thin big yards long-sleeved dress bottoming
dress","https://www.lazada.com.my/color-diana-2017-autumn-and-winter-new-korean-version-of-womensbutterfly-knot-slim-was-thin-big-yards-long-sleeved-dress-bottomingdress-81115914.html?ff=1&sc=IYsE","4","https://www.lazada.com.my/taobao-collection/?page=4&sc=IYsE"
"","","QZM magnetic sketchpad can lift whiteboard small blackboard children's double-sided stand-home painting frame writing board","https://www.lazada.com.my/qzm-magnetic-sketchpad-can-lift-whiteboard-small-blackboard-children39s-double-sided-stand-home-painting-frame-writing-board-45694300.html?ff=1&sc=IYsE","4","https://www.lazada.com.my/taobao-collection/?page=4&sc=IYsE"
"","","Color Diana New style Slim fit sleeve Slimming effect solid color
dress","https://www.lazada.com.my/color-diana-new-style-slim-fit-sleeve-slimming-effect-solid-colordress-47375996.html?ff=1&sc=IYsE","",""
"","","College British style small leather shoes 2017 Spring and Autumn New style wild Korean-style music fu shoes in thick with single shoes female tide (Wine red color)","https://www.lazada.com.my/college-british-style-small-leather-shoes-2017-spring-and-autumn-new-style-wild-korean-style-music-fu-shoes-in-thick-with-single-shoes-female-tide-wine-red-color-81134384.html?ff=1&sc=IYsE","4","https://www.lazada.com.my/taobao-collection/?page=4&sc=IYsE"
"","","Black female thin section summer pencil pants bottoming pants (Black) (Black)","https://www.lazada.com.my/black-female-thin-section-summer-pencil-pants-bottoming-pants-black-black-40040450.html?ff=1&sc=IYsE","",""
"","","Cat bath cage supplies two-door pet wash cat cage cat hair
injections anti-catch bite cat cage free shipping","https://www.lazada.com.my/cat-bath-cage-supplies-two-door-pet-wash-cat-cage-cat-hairinjections-anti-catch-bite-cat-cage-free-shipping-87222652.html?ff=1&sc=IYsE","5","https://www.lazada.com.my/taobao-collection/?page=5&sc=IYsE"
"","","Teapot old bamboo pot large capacity ore famous suit","https://www.lazada.com.my/teapot-old-bamboo-pot-large-capacity-ore-famous-suit-58214305.html?ff=1&sc=IYsE","32959","https://www.lazada.com.my/taobao-collection/?page=32959&sc=IYsE"
"","","Lauva 3 way Cat tunnel toy for cats kittens puppy bunny","https://www.lazada.com.my/lauva-3-way-cat-tunnel-toy-for-cats-kittens-puppy-bunny-90873553.html?ff=1&sc=IYsE","3","https://www.lazada.com.my/taobao-collection/?page=3&sc=IYsE"
"","","Han Feng chic Top female wild retro hoodie female Hong Kong style
long-sleeved t-shirt female ulzzang social female clothes (158 *
white (thin section))","https://www.lazada.com.my/han-feng-chic-top-female-wild-retro-hoodie-female-hong-kong-stylelong-sleeved-t-shirt-female-ulzzang-social-female-clothes-158-white-thin-section-81099863.html?ff=1&sc=IYsE","",""
"","","Shuangqing single layer kitchen soap rack soap dish","https://www.lazada.com.my/shuangqing-single-layer-kitchen-soap-rack-soap-dish-110928486.html?ff=1&sc=IYsE","32959","https://www.lazada.com.my/taobao-collection/?page=32959&sc=IYsE"
"","","Evening dresses 2016 summer long party dress big size dress Dress","https://www.lazada.com.my/evening-dresses-2016-summer-long-party-dress-big-size-dress-dress-45772383.html?ff=1&sc=IYsE","3","https://www.lazada.com.my/taobao-collection/?page=3&sc=IYsE"
"","","Adult flight chess large game chess crawling pad","https://www.lazada.com.my/adult-flight-chess-large-game-chess-crawling-pad-41780205.html?ff=1&sc=IYsE","5","https://www.lazada.com.my/taobao-collection/?page=5&sc=IYsE"
"","","Flat with pointed hollow shoes hole shoes (Beige) (Beige)","https://www.lazada.com.my/flat-with-pointed-hollow-shoes-hole-shoes-beige-beige-51192136.html?ff=1&sc=IYsE","1","https://www.lazada.com.my/taobao-collection/?sc=IYsE"
"","","2017 Korean-style spring and summer New style pointed flat shoes
women shoes flat with shallow mouth Four Seasons shoes simple spell
color shoes (Gray)","https://www.lazada.com.my/2017-korean-style-spring-and-summer-new-style-pointed-flat-shoeswomen-shoes-flat-with-shallow-mouth-four-seasons-shoes-simple-spellcolor-shoes-gray-73932102.html?ff=1&sc=IYsE","3","https://www.lazada.com.my/taobao-collection/?page=3&sc=IYsE"
"","","Cat cage double three layer cat Villa large two layer folding
through body to send cat climbing frame breeding cat cage","https://www.lazada.com.my/cat-cage-double-three-layer-cat-villa-large-two-layer-foldingthrough-body-to-send-cat-climbing-frame-breeding-cat-cage-87133598.html?ff=1&sc=IYsE","2","https://www.lazada.com.my/taobao-collection/?page=2&sc=IYsE"
"","","Color Diana New style temperament Slim fit waist knit dress","https://www.lazada.com.my/color-diana-new-style-temperament-slim-fit-waist-knit-dress-47375834.html?ff=1&sc=IYsE","3","https://www.lazada.com.my/taobao-collection/?page=3&sc=IYsE"
"","","2017 spring and autumn canvas shoes women shoes wild street shooting white shoes spring Korean-style casual flat student shoes (A76 blue)","https://www.lazada.com.my/2017-spring-and-autumn-canvas-shoes-women-shoes-wild-street-shooting-white-shoes-spring-korean-style-casual-flat-student-shoes-a76-blue-88045189.html?ff=1&sc=IYsE","",""
"","","Korean-style mini bucket bag handbag (Black) (Black)","https://www.lazada.com.my/korean-style-mini-bucket-bag-handbag-black-black-51245527.html?ff=1&sc=IYsE","4","https://www.lazada.com.my/taobao-collection/?page=4&sc=IYsE"
"","","Versatile autumn New style a pedal I women's shoes (6622 black)","https://www.lazada.com.my/versatile-autumn-new-style-a-pedal-i-women39s-shoes-6622-black-88045169.html?ff=1&sc=IYsE","1","https://www.lazada.com.my/taobao-collection/?sc=IYsE"
"","","Yoga exercise shoes 2017 New style Korean-style breathable casual flat mesh shoes couple sports shoes women running shoes (Pink color)","https://www.lazada.com.my/yoga-exercise-shoes-2017-new-style-korean-style-breathable-casual-flat-mesh-shoes-couple-sports-shoes-women-running-shoes-pink-color-73933767.html?ff=1&sc=IYsE","1","https://www.lazada.com.my/taobao-collection/?sc=IYsE"
"","","Kitchen three layer multi-function storage rack dish rack","https://www.lazada.com.my/kitchen-three-layer-multi-function-storage-rack-dish-rack-82660746.html?ff=1&sc=IYsE","1","https://www.lazada.com.my/taobao-collection/?sc=IYsE"
"","","Children's toys desktop educational wooden beaded beads around the
frame","https://www.lazada.com.my/childrens-toys-desktop-educational-wooden-beaded-beads-around-theframe-52509596.html?ff=1&sc=IYsE","2","https://www.lazada.com.my/taobao-collection/?page=2&sc=IYsE"
"","","304 stainless steel kitchen drain water dish rack hanging Put dishes plate supplies chopsticks storage box glove rack double cabinet","https://www.lazada.com.my/304-stainless-steel-kitchen-drain-water-dish-rack-hanging-put-dishes-plate-supplies-chopsticks-storage-box-glove-rack-double-cabinet-82616822.html?ff=1&sc=IYsE","3","https://www.lazada.com.my/taobao-collection/?page=3&sc=IYsE"
"","","Versatile autumn New style a pedal I women's shoes (6622 black)","https://www.lazada.com.my/versatile-autumn-new-style-a-pedal-i-women39s-shoes-6622-black-88045169.html?ff=1&sc=IYsE","",""
"","","Indoor simple clothes rack","https://www.lazada.com.my/indoor-simple-clothes-rack-42630732.html?ff=1&sc=IYsE","3","https://www.lazada.com.my/taobao-collection/?page=3&sc=IYsE"
"","","As Hong crystal original stone natural calcite ore ornaments
through the body specimens stone optical research Ore","https://www.lazada.com.my/as-hong-crystal-original-stone-natural-calcite-ore-ornamentsthrough-the-body-specimens-stone-optical-research-ore-74576207.html?ff=1&sc=IYsE","5","https://www.lazada.com.my/taobao-collection/?page=5&sc=IYsE"
"","","Southern copper cover copper the pig iron pot Cast Iron teapot","https://www.lazada.com.my/southern-copper-cover-copper-the-pig-iron-pot-cast-iron-teapot-104424139.html?ff=1&sc=IYsE","5","https://www.lazada.com.my/taobao-collection/?page=5&sc=IYsE"
"","","Cartoon children's kindergarten rubber rub","https://www.lazada.com.my/cartoon-children39s-kindergarten-rubber-rub-67525170.html?ff=1&sc=IYsE","4","https://www.lazada.com.my/taobao-collection/?page=4&sc=IYsE"
"","","Girl is foot piano newborn children, 0-1 years old toys","https://www.lazada.com.my/girl-is-foot-piano-newborn-children-0-1-years-old-toys-50865617.html?ff=1&sc=IYsE","",""
"","","BF Korean-style New style Loose and plus-sized wild denim jacket","https://www.lazada.com.my/bf-korean-style-new-style-loose-and-plus-sized-wild-denim-jacket-45579639.html?ff=1&sc=IYsE","5","https://www.lazada.com.my/taobao-collection/?page=5&sc=IYsE"
"","","Color Diana New style sleeve knit bottoming skirt dress","https://www.lazada.com.my/color-diana-new-style-sleeve-knit-bottoming-skirt-dress-43313672.html?ff=1&sc=IYsE","1","https://www.lazada.com.my/taobao-collection/?sc=IYsE"
"","","Non-toxic wooden bead toys for baby Taobao","https://www.lazada.com.my/non-toxic-wooden-bead-toys-for-baby-taobao-51055187.html?ff=1&sc=IYsE","",""
"","","Color Diana 2017 autumn and winter new women's fashion Korean
version of Slim was thin big yards bottoming fashion knitted dress","https://www.lazada.com.my/color-diana-2017-autumn-and-winter-new-womens-fashion-koreanversion-of-slim-was-thin-big-yards-bottoming-fashion-knitted-dress-43588619.html?ff=1&sc=IYsE","5","https://www.lazada.com.my/taobao-collection/?page=5&sc=IYsE"
"","","Korean-style men's short-sleeved Collar Short sleeve t-shirt polo
shirt","https://www.lazada.com.my/korean-style-mens-short-sleeved-collar-short-sleeve-t-shirt-poloshirt-62736110.html?ff=1&sc=IYsE","4","https://www.lazada.com.my/taobao-collection/?page=4&sc=IYsE"
"","","Children over every family toys can be cut fruit and vegetables
honestly happy to see the boy girls Kitchen toys set","https://www.lazada.com.my/children-over-every-family-toys-can-be-cut-fruit-and-vegetableshonestly-happy-to-see-the-boy-girls-kitchen-toys-set-75261623.html?ff=1&sc=IYsE","3","https://www.lazada.com.my/taobao-collection/?page=3&sc=IYsE"
"","","Summer Collar short-sleeved denim skirt denim dress","https://www.lazada.com.my/summer-collar-short-sleeved-denim-skirt-denim-dress-57250708.html?ff=1&sc=IYsE","2","https://www.lazada.com.my/taobao-collection/?page=2&sc=IYsE"
"","","ENLIGHTEN Yi Zhi early childhood toys beaded bracelet","https://www.lazada.com.my/enlighten-yi-zhi-early-childhood-toys-beaded-bracelet-101791570.html?ff=1&sc=IYsE","3","https://www.lazada.com.my/taobao-collection/?page=3&sc=IYsE"
"","","Montessori intelligence children's toys early childhood beat Taiwan
hammer box","https://www.lazada.com.my/montessori-intelligence-childrens-toys-early-childhood-beat-taiwanhammer-box-64696833.html?ff=1&sc=IYsE","",""
"","","Shoes female 2017 Spring and Autumn New style Korean-style round flat lace casual sports shoes Shoes college white shoes","https://www.lazada.com.my/shoes-female-2017-spring-and-autumn-new-style-korean-style-round-flat-lace-casual-sports-shoes-shoes-college-white-shoes-81101064.html?ff=1&sc=IYsE","3","https://www.lazada.com.my/taobao-collection/?page=3&sc=IYsE"
"","","Bathroom toilet hand washing room washed Taiwan wall hangers bathroom shelf","https://www.lazada.com.my/bathroom-toilet-hand-washing-room-washed-taiwan-wall-hangers-bathroom-shelf-98934772.html?ff=1&sc=IYsE","3","https://www.lazada.com.my/taobao-collection/?page=3&sc=IYsE"
"","","Color Diana Slim fit gray grid bottoming fashion wild dress","https://www.lazada.com.my/color-diana-slim-fit-gray-grid-bottoming-fashion-wild-dress-47356206.html?ff=1&sc=IYsE","4","https://www.lazada.com.my/taobao-collection/?page=4&sc=IYsE"
"","","New style temperament v-neck Slim fit Korean-style long-sleeved
dress","https://www.lazada.com.my/new-style-temperament-v-neck-slim-fit-korean-style-long-sleeveddress-70394399.html?ff=1&sc=IYsE","32959","https://www.lazada.com.my/taobao-collection/?page=32959&sc=IYsE"
"","","Door after hook-free nail bold hanging clothes rack seamless storage bathroom bedroom towel rack hanging clothes hook","https://www.lazada.com.my/door-after-hook-free-nail-bold-hanging-clothes-rack-seamless-storage-bathroom-bedroom-towel-rack-hanging-clothes-hook-44926197.html?ff=1&sc=IYsE","5","https://www.lazada.com.my/taobao-collection/?page=5&sc=IYsE"
"","","2017 summer New style Plus-sized loose short-sleeved t-shirt female
round neck striped Top wild bottoming shirt female small effort
(579 * red striped)","https://www.lazada.com.my/2017-summer-new-style-plus-sized-loose-short-sleeved-t-shirt-femaleround-neck-striped-top-wild-bottoming-shirt-female-small-effort579-red-striped-73932750.html?ff=1&sc=IYsE","",""
"","","Children's 3-6-12 a month newborn children music toys baby toys fitness frame baby 0-1-year-old fitness device","https://www.lazada.com.my/children39s-3-6-12-a-month-newborn-children-music-toys-baby-toys-fitness-frame-baby-0-1-year-old-fitness-device-52517767.html?ff=1&sc=IYsE","32959","https://www.lazada.com.my/taobao-collection/?page=32959&sc=IYsE"
"","","I the world people Aberdeen Minecraft building blocks people coolie
cave scene dolls doll hand to do toys","https://www.lazada.com.my/i-the-world-people-aberdeen-minecraft-building-blocks-people-cooliecave-scene-dolls-doll-hand-to-do-toys-59001308.html?ff=1&sc=IYsE","32959","https://www.lazada.com.my/taobao-collection/?page=32959&sc=IYsE"
"","","Ms. New style shoulder tide wild chest pack","https://www.lazada.com.my/ms-new-style-shoulder-tide-wild-chest-pack-67291575.html?ff=1&sc=IYsE","2","https://www.lazada.com.my/taobao-collection/?page=2&sc=IYsE"
"","","Milk tea barrel insulation barrel not stainless steel commercial
milk bucket herbal tea barrel juice bucket drink faucet double
large capacity","https://www.lazada.com.my/milk-tea-barrel-insulation-barrel-not-stainless-steel-commercialmilk-bucket-herbal-tea-barrel-juice-bucket-drink-faucet-doublelarge-capacity-90941948.html?ff=1&sc=IYsE","4","https://www.lazada.com.my/taobao-collection/?page=4&sc=IYsE"
"","","Home folding hanging scarf the 28 circle single scarf rack","https://www.lazada.com.my/home-folding-hanging-scarf-the-28-circle-single-scarf-rack-43458683.html?ff=1&sc=IYsE","2","https://www.lazada.com.my/taobao-collection/?page=2&sc=IYsE"
"","","Baby striped hoodie 2017 autumn and dress New style boy children's clothing children's long-sleeved jacket zip wt-7759","https://www.lazada.com.my/baby-striped-hoodie-2017-autumn-and-dress-new-style-boy-children39s-clothing-children39s-long-sleeved-jacket-zip-wt-7759-73956190.html?ff=1&sc=IYsE","4","https://www.lazada.com.my/taobao-collection/?page=4&sc=IYsE"
"","","Female Slim fit lace Top T-shirt (5304-black)","https://www.lazada.com.my/female-slim-fit-lace-top-t-shirt-5304-black-83111893.html?ff=1&sc=IYsE","3","https://www.lazada.com.my/taobao-collection/?page=3&sc=IYsE"
"","","50*60 blank painting frame acrylic painting paint practice painting
box sail cotton 50* 60cm oil painting frame","https://www.lazada.com.my/5060-blank-painting-frame-acrylic-painting-paint-practice-paintingbox-sail-cotton-50-60cm-oil-painting-frame-60157062.html?ff=1&sc=IYsE","5","https://www.lazada.com.my/taobao-collection/?page=5&sc=IYsE"
"","","Black thin section spring and summer outer wear pants bottoming
pants","https://www.lazada.com.my/black-thin-section-spring-and-summer-outer-wear-pants-bottomingpants-62760849.html?ff=1&sc=IYsE","2","https://www.lazada.com.my/taobao-collection/?page=2&sc=IYsE"
"","","2017 New style pointed flat shoes female shallow mouth shoes to help low casual shoes scoop shoes Spring and Autumn minimalist Four Seasons shoes (Deep Brown)","https://www.lazada.com.my/2017-new-style-pointed-flat-shoes-female-shallow-mouth-shoes-to-help-low-casual-shoes-scoop-shoes-spring-and-autumn-minimalist-four-seasons-shoes-deep-brown-83235806.html?ff=1&sc=IYsE","1","https://www.lazada.com.my/taobao-collection/?sc=IYsE"
