link,link-href,linked,linked-href,pagination,pagination-href
"","","Female shoes New style heavy-bottomed student breathable lace white
shoes (Platinum) (Platinum)","https://www.lazada.com.my/female-shoes-new-style-heavy-bottomed-student-breathable-lace-whiteshoes-platinum-platinum-51217816.html?ff=1&sc=IYsE","",""
"","","Stylish knot casual watch Fashion watch","https://www.lazada.com.my/stylish-knot-casual-watch-fashion-watch-68163228.html?ff=1&sc=IYsE","4","https://www.lazada.com.my/taobao-collection/?page=4&sc=IYsE"
"","","Han Feng chic Top female wild retro hoodie female Hong Kong style
long-sleeved t-shirt female ulzzang social female clothes (158 *
white (thin section))","https://www.lazada.com.my/han-feng-chic-top-female-wild-retro-hoodie-female-hong-kong-stylelong-sleeved-t-shirt-female-ulzzang-social-female-clothes-158-white-thin-section-81099863.html?ff=1&sc=IYsE","1","https://www.lazada.com.my/taobao-collection/?sc=IYsE"
"","","Children's sd01 stationery cartoon Christmas rubber sleeve pencil","https://www.lazada.com.my/children39s-sd01-stationery-cartoon-christmas-rubber-sleeve-pencil-67536617.html?ff=1&sc=IYsE","2","https://www.lazada.com.my/taobao-collection/?page=2&sc=IYsE"
"","","Frameless painting hanging clocks restaurant crystal living room
bedroom Mediterranean decorative painting cartoon paintings meter
box wall painting","https://www.lazada.com.my/frameless-painting-hanging-clocks-restaurant-crystal-living-roombedroom-mediterranean-decorative-painting-cartoon-paintings-meterbox-wall-painting-60439671.html?ff=1&sc=IYsE","32959","https://www.lazada.com.my/taobao-collection/?page=32959&sc=IYsE"
"","","Cartoon nap pillow quilt car pillow quilt dual cushions were large
air conditioning was pillow blanket","https://www.lazada.com.my/cartoon-nap-pillow-quilt-car-pillow-quilt-dual-cushions-were-largeair-conditioning-was-pillow-blanket-52628612.html?ff=1&sc=IYsE","3","https://www.lazada.com.my/taobao-collection/?page=3&sc=IYsE"
"","","Shuangqing punched wall hangers-bathroom storage rack sucker towel rack","https://www.lazada.com.my/shuangqing-punched-wall-hangers-bathroom-storage-rack-sucker-towel-rack-98936076.html?ff=1&sc=IYsE","5","https://www.lazada.com.my/taobao-collection/?page=5&sc=IYsE"
"","","Color Diana New style Slim fit Korean-style solid color short-sleeved chiffon shirt","https://www.lazada.com.my/color-diana-new-style-slim-fit-korean-style-solid-color-short-sleeved-chiffon-shirt-47380298.html?ff=1&sc=IYsE","1","https://www.lazada.com.my/taobao-collection/?sc=IYsE"
"","","European leg New style Print sleeveless Slimming effect
Korean-style a word dress (White)","https://www.lazada.com.my/european-leg-new-style-print-sleeveless-slimming-effectkorean-style-a-word-dress-white-44072015.html?ff=1&sc=IYsE","4","https://www.lazada.com.my/taobao-collection/?page=4&sc=IYsE"
"","","Hy/Han Yu male girl children's wooden made educational baby 1-2-3
year old to fight to mouse building blocks toys large","https://www.lazada.com.my/hyhan-yu-male-girl-childrens-wooden-made-educational-baby-1-2-3year-old-to-fight-to-mouse-building-blocks-toys-large-64687299.html?ff=1&sc=IYsE","5","https://www.lazada.com.my/taobao-collection/?page=5&sc=IYsE"
"","","Benro accessories tripod accessories head quick release plate screw
connection 1/4 to 3/8 screw Cover Screw Cap","https://www.lazada.com.my/benro-accessories-tripod-accessories-head-quick-release-plate-screwconnection-14-to-38-screw-cover-screw-cap-85425131.html?ff=1&sc=IYsE","32959","https://www.lazada.com.my/taobao-collection/?page=32959&sc=IYsE"
"","","Rubber rub cute cartoon students children's 2B rubber rub art special rubber eraser exam stationery prizes wholesale","https://www.lazada.com.my/rubber-rub-cute-cartoon-students-children39s-2b-rubber-rub-art-special-rubber-eraser-exam-stationery-prizes-wholesale-72217040.html?ff=1&sc=IYsE","4","https://www.lazada.com.my/taobao-collection/?page=4&sc=IYsE"
"","","Round pot with glove rack floor multi-layer seasoning rack kitchen
table storage rack dishes storage rack with a pulley","https://www.lazada.com.my/round-pot-with-glove-rack-floor-multi-layer-seasoning-rack-kitchentable-storage-rack-dishes-storage-rack-with-a-pulley-82686197.html?ff=1&sc=IYsE","32959","https://www.lazada.com.my/taobao-collection/?page=32959&sc=IYsE"
"","","2017 Spring and Autumn Korean-style sexy female high-heeled shoes fine with pointed suede Diamond shoes black professional shoes Shoes (Black (general paragraph))","https://www.lazada.com.my/2017-spring-and-autumn-korean-style-sexy-female-high-heeled-shoes-fine-with-pointed-suede-diamond-shoes-black-professional-shoes-shoes-black-general-paragraph-73950090.html?ff=1&sc=IYsE","1","https://www.lazada.com.my/taobao-collection/?sc=IYsE"
"","","BASEUS iphone8/7 plus Apple clip charger portable phone case","https://www.lazada.com.my/baseus-iphone87-plus-apple-clip-charger-portable-phone-case-96648181.html?ff=1&sc=IYsE","32959","https://www.lazada.com.my/taobao-collection/?page=32959&sc=IYsE"
"","","Korean-style cotton loose horn short-sleeved Top Women's striped T-shirt","https://www.lazada.com.my/korean-style-cotton-loose-horn-short-sleeved-top-women39s-striped-t-shirt-44938904.html?ff=1&sc=IYsE","5","https://www.lazada.com.my/taobao-collection/?page=5&sc=IYsE"
"","","Modern geometric living room coffee table full shop big black and
white gray mats","https://www.lazada.com.my/modern-geometric-living-room-coffee-table-full-shop-big-black-andwhite-gray-mats-70897091.html?ff=1&sc=IYsE","1","https://www.lazada.com.my/taobao-collection/?sc=IYsE"
"","","Children's Sketchpad baby Painting Board wood magnetic stand-","https://www.lazada.com.my/childrens-sketchpad-baby-painting-board-wood-magnetic-stand-51129009.html?ff=1&sc=IYsE","2","https://www.lazada.com.my/taobao-collection/?page=2&sc=IYsE"
"","","Southern Iron pot pig iron pot cast iron pot Kung Fu tea","https://www.lazada.com.my/southern-iron-pot-pig-iron-pot-cast-iron-pot-kung-fu-tea-101863517.html?ff=1&sc=IYsE","5","https://www.lazada.com.my/taobao-collection/?page=5&sc=IYsE"
"","","As Hong crystal original stone natural calcite ball ornaments home
feng shui crystal ball ornaments yellow crystal ball","https://www.lazada.com.my/as-hong-crystal-original-stone-natural-calcite-ball-ornaments-homefeng-shui-crystal-ball-ornaments-yellow-crystal-ball-74875511.html?ff=1&sc=IYsE","5","https://www.lazada.com.my/taobao-collection/?page=5&sc=IYsE"
"","","Solid family plastic put dish rack dishes drain rack cupboard kitchen shelf plate dishes storage box supplies 2","https://www.lazada.com.my/solid-family-plastic-put-dish-rack-dishes-drain-rack-cupboard-kitchen-shelf-plate-dishes-storage-box-supplies-2-82623878.html?ff=1&sc=IYsE","2","https://www.lazada.com.my/taobao-collection/?page=2&sc=IYsE"
"","","Korean spring New style hit color cardigan jacket (White)","https://www.lazada.com.my/korean-spring-new-style-hit-color-cardigan-jacket-white-40906618.html?ff=1&sc=IYsE","",""
"","","Color Diana New style off-the-shoulder lotus leaf sleeve tide
short-sleeved chiffon shirt","https://www.lazada.com.my/color-diana-new-style-off-the-shoulder-lotus-leaf-sleeve-tideshort-sleeved-chiffon-shirt-47371244.html?ff=1&sc=IYsE","4","https://www.lazada.com.my/taobao-collection/?page=4&sc=IYsE"
"","","Cartoon small yellow people pencil children's primary school
kindergarten prizes gift school supplies stationery wholesale HB
pencil","https://www.lazada.com.my/cartoon-small-yellow-people-pencil-childrens-primary-schoolkindergarten-prizes-gift-school-supplies-stationery-wholesale-hbpencil-69410497.html?ff=1&sc=IYsE","3","https://www.lazada.com.my/taobao-collection/?page=3&sc=IYsE"
"","","Hino 300 Gogo van Hino tail plate truck model","https://www.lazada.com.my/hino-300-gogo-van-hino-tail-plate-truck-model-64617148.html?ff=1&sc=IYsE","32959","https://www.lazada.com.my/taobao-collection/?page=32959&sc=IYsE"
"","","Color Diana 2017 autumn and winter new Korean women slim wild
bottoming long-sleeved shirt fashion shirt chiffon shirt (Pink
(short sleeve))","https://www.lazada.com.my/color-diana-2017-autumn-and-winter-new-korean-women-slim-wildbottoming-long-sleeved-shirt-fashion-shirt-chiffon-shirt-pinkshort-sleeve-43439119.html?ff=1&sc=IYsE","32959","https://www.lazada.com.my/taobao-collection/?page=32959&sc=IYsE"
"","","Color Diana New style Slim fit sleeve Slimming effect solid color
dress","https://www.lazada.com.my/color-diana-new-style-slim-fit-sleeve-slimming-effect-solid-colordress-47375996.html?ff=1&sc=IYsE","1","https://www.lazada.com.my/taobao-collection/?sc=IYsE"
"","","BYL 12 hanging clothes hanger coat stand storage popheko","https://www.lazada.com.my/byl-12-hanging-clothes-hanger-coat-stand-storage-popheko-96044111.html?ff=1&sc=IYsE","3","https://www.lazada.com.my/taobao-collection/?page=3&sc=IYsE"
"","","Lucky 0780 natural gold feng shui home accessories furnishings","https://www.lazada.com.my/lucky-0780-natural-gold-feng-shui-home-accessories-furnishings-39645522.html?ff=1&sc=IYsE","32959","https://www.lazada.com.my/taobao-collection/?page=32959&sc=IYsE"
"","","Children's multi-function educational nut car","https://www.lazada.com.my/childrens-multi-function-educational-nut-car-50943615.html?ff=1&sc=IYsE","2","https://www.lazada.com.my/taobao-collection/?page=2&sc=IYsE"
"","","Color Diana New style sleeve knit bottoming skirt dress","https://www.lazada.com.my/color-diana-new-style-sleeve-knit-bottoming-skirt-dress-43313672.html?ff=1&sc=IYsE","",""
"","","Yongjun athletic flying stack of cup tournament cup","https://www.lazada.com.my/yongjun-athletic-flying-stack-of-cup-tournament-cup-104499818.html?ff=1&sc=IYsE","4","https://www.lazada.com.my/taobao-collection/?page=4&sc=IYsE"
"","","Fiat Hot Wheels Wind Fire Wheel boutique car","https://www.lazada.com.my/fiat-hot-wheels-wind-fire-wheel-boutique-car-51055617.html?ff=1&sc=IYsE","32959","https://www.lazada.com.my/taobao-collection/?page=32959&sc=IYsE"
"","","Art Linen Plus-sized loose long dress Dress (Navy blue) (Navy blue)","https://www.lazada.com.my/art-linen-plus-sized-loose-long-dress-dress-navy-blue-navy-blue-47369169.html?ff=1&sc=IYsE","3","https://www.lazada.com.my/taobao-collection/?page=3&sc=IYsE"
"","","Metal Lens Hood 52mm standard straight metal hood for SLR","https://www.lazada.com.my/metal-lens-hood-52mm-standard-straight-metal-hood-for-slr-41605917.html?ff=1&sc=IYsE","32959","https://www.lazada.com.my/taobao-collection/?page=32959&sc=IYsE"
"","","Name is glass cup whiskey wine glass wine glasses suit retro white
wine brandy glass","https://www.lazada.com.my/name-is-glass-cup-whiskey-wine-glass-wine-glasses-suit-retro-whitewine-brandy-glass-87884990.html?ff=1&sc=IYsE","5","https://www.lazada.com.my/taobao-collection/?page=5&sc=IYsE"
"","","Kitchen door back-stainless steel towel rack","https://www.lazada.com.my/kitchen-door-back-stainless-steel-towel-rack-40881157.html?ff=1&sc=IYsE","",""
"","","Korean-style printed Slim fit slimming dress chiffon skirt","https://www.lazada.com.my/korean-style-printed-slim-fit-slimming-dress-chiffon-skirt-97801288.html?ff=1&sc=IYsE","5","https://www.lazada.com.my/taobao-collection/?page=5&sc=IYsE"
"","","Multi-functional clothes rack does not rust steel S-type
multi-layer pants rack pants hanger closet storage pants hanging
pants folder pants hanging clothes rack","https://www.lazada.com.my/multi-functional-clothes-rack-does-not-rust-steel-s-typemulti-layer-pants-rack-pants-hanger-closet-storage-pants-hangingpants-folder-pants-hanging-clothes-rack-52046221.html?ff=1&sc=IYsE","",""
"","","Multi-functional clothes rack does not rust steel S-type
multi-layer pants rack pants hanger closet storage pants hanging
pants folder pants hanging clothes rack","https://www.lazada.com.my/multi-functional-clothes-rack-does-not-rust-steel-s-typemulti-layer-pants-rack-pants-hanger-closet-storage-pants-hangingpants-folder-pants-hanging-clothes-rack-52046221.html?ff=1&sc=IYsE","1","https://www.lazada.com.my/taobao-collection/?sc=IYsE"
"","","Rr9018 waterproof motorcycle car back seat bag rear box bag rear tail box","https://www.lazada.com.my/rr9018-waterproof-motorcycle-car-back-seat-bag-rear-box-bag-rear-tail-box-91315282.html?ff=1&sc=IYsE","3","https://www.lazada.com.my/taobao-collection/?page=3&sc=IYsE"
"","","Baby wooden trailer early childhood puzzle fight inserted small train","https://www.lazada.com.my/baby-wooden-trailer-early-childhood-puzzle-fight-inserted-small-train-64531008.html?ff=1&sc=IYsE","2","https://www.lazada.com.my/taobao-collection/?page=2&sc=IYsE"
"","","Factory direct free shipping blue automatic double hole electric
pencil sharpener students dedicated children's brush to pen volume
pen knife","https://www.lazada.com.my/factory-direct-free-shipping-blue-automatic-double-hole-electricpencil-sharpener-students-dedicated-childrens-brush-to-pen-volumepen-knife-73724371.html?ff=1&sc=IYsE","3","https://www.lazada.com.my/taobao-collection/?page=3&sc=IYsE"
"","","Small small yi sheng xiang children's doctor toys","https://www.lazada.com.my/small-small-yi-sheng-xiang-children39s-doctor-toys-41876967.html?ff=1&sc=IYsE","32959","https://www.lazada.com.my/taobao-collection/?page=32959&sc=IYsE"
"","","Kitchen door back-stainless steel towel rack","https://www.lazada.com.my/kitchen-door-back-stainless-steel-towel-rack-40881157.html?ff=1&sc=IYsE","1","https://www.lazada.com.my/taobao-collection/?sc=IYsE"
"","","Home creative seamless hanger clothes child support hanging clothes rack drying racks home stays hanging clothes rack clothing","https://www.lazada.com.my/home-creative-seamless-hanger-clothes-child-support-hanging-clothes-rack-drying-racks-home-stays-hanging-clothes-rack-clothing-62026770.html?ff=1&sc=IYsE","32959","https://www.lazada.com.my/taobao-collection/?page=32959&sc=IYsE"
"","","Korea stationery wooden small blackboard drawer pen fashion cute
creative office desktop storage to send chalk eraser","https://www.lazada.com.my/korea-stationery-wooden-small-blackboard-drawer-pen-fashion-cutecreative-office-desktop-storage-to-send-chalk-eraser-42640915.html?ff=1&sc=IYsE","5","https://www.lazada.com.my/taobao-collection/?page=5&sc=IYsE"
"","","Montessori intelligence children's toys early childhood beat Taiwan
hammer box","https://www.lazada.com.my/montessori-intelligence-childrens-toys-early-childhood-beat-taiwanhammer-box-64696833.html?ff=1&sc=IYsE","1","https://www.lazada.com.my/taobao-collection/?sc=IYsE"
"","","Multi-function SLR decompression camera strap can be hanging
shoulder back photography bag with fast photo hand camera fast hang
strap","https://www.lazada.com.my/multi-function-slr-decompression-camera-strap-can-be-hangingshoulder-back-photography-bag-with-fast-photo-hand-camera-fast-hangstrap-85414944.html?ff=1&sc=IYsE","32959","https://www.lazada.com.my/taobao-collection/?page=32959&sc=IYsE"
"","","Qiudong Plus velvet winter style children's shirt (Green)","https://www.lazada.com.my/qiudong-plus-velvet-winter-style-children39s-shirt-green-64514273.html?ff=1&sc=IYsE","4","https://www.lazada.com.my/taobao-collection/?page=4&sc=IYsE"
"","","Micro-flaws products processing beginner's yoga mat girl children's dance practice mat fitness mat yoga mat carpet","https://www.lazada.com.my/micro-flaws-products-processing-beginner39s-yoga-mat-girl-children39s-dance-practice-mat-fitness-mat-yoga-mat-carpet-73726139.html?ff=1&sc=IYsE","2","https://www.lazada.com.my/taobao-collection/?page=2&sc=IYsE"
"","","Black female thin section summer pencil pants bottoming pants (Black) (Black)","https://www.lazada.com.my/black-female-thin-section-summer-pencil-pants-bottoming-pants-black-black-40040450.html?ff=1&sc=IYsE","1","https://www.lazada.com.my/taobao-collection/?sc=IYsE"
"","","Old Beijing shoes Shoes shoes Korean-style wild female flat student
casual lace sports shoes women running shoes (916 black)","https://www.lazada.com.my/old-beijing-shoes-shoes-shoes-korean-style-wild-female-flat-studentcasual-lace-sports-shoes-women-running-shoes-916-black-88045205.html?ff=1&sc=IYsE","2","https://www.lazada.com.my/taobao-collection/?page=2&sc=IYsE"
"","","Spring new korean suspenders denim overalls feet casual trousers pants female college students wind was thin piece pants","https://www.lazada.com.my/spring-new-korean-suspenders-denim-overalls-feet-casual-trousers-pants-female-college-students-wind-was-thin-piece-pants-40876781.html?ff=1&sc=IYsE","",""
"","","2017 summer New style Plus-sized loose short-sleeved t-shirt female
round neck striped Top wild bottoming shirt female small effort
(579 * red striped)","https://www.lazada.com.my/2017-summer-new-style-plus-sized-loose-short-sleeved-t-shirt-femaleround-neck-striped-top-wild-bottoming-shirt-female-small-effort579-red-striped-73932750.html?ff=1&sc=IYsE","1","https://www.lazada.com.my/taobao-collection/?sc=IYsE"
"","","Korean-style waterproof large wash bag makeup bag Mary Kay large
capacity portable cosmetic bag storage bag makeup bag","https://www.lazada.com.my/korean-style-waterproof-large-wash-bag-makeup-bag-mary-kay-largecapacity-portable-cosmetic-bag-storage-bag-makeup-bag-87112447.html?ff=1&sc=IYsE","2","https://www.lazada.com.my/taobao-collection/?page=2&sc=IYsE"
"","","Spring new korean suspenders denim overalls feet casual trousers pants female college students wind was thin piece pants","https://www.lazada.com.my/spring-new-korean-suspenders-denim-overalls-feet-casual-trousers-pants-female-college-students-wind-was-thin-piece-pants-40876781.html?ff=1&sc=IYsE","1","https://www.lazada.com.my/taobao-collection/?sc=IYsE"
"","","Baby home plastic wind towel air dry rack shelf","https://www.lazada.com.my/baby-home-plastic-wind-towel-air-dry-rack-shelf-63324178.html?ff=1&sc=IYsE","32959","https://www.lazada.com.my/taobao-collection/?page=32959&sc=IYsE"
"","","2017 autumn New style Korean-style thick with pointed high-heeled shoes a word buckle Pearl shoes shallow mouth suede shoes female (Beige)","https://www.lazada.com.my/2017-autumn-new-style-korean-style-thick-with-pointed-high-heeled-shoes-a-word-buckle-pearl-shoes-shallow-mouth-suede-shoes-female-beige-83242966.html?ff=1&sc=IYsE","5","https://www.lazada.com.my/taobao-collection/?page=5&sc=IYsE"
"","","Korean-style Female Summer new white Top chiffon shirt","https://www.lazada.com.my/korean-style-female-summer-new-white-top-chiffon-shirt-57361749.html?ff=1&sc=IYsE","2","https://www.lazada.com.my/taobao-collection/?page=2&sc=IYsE"
"","","2017 Spring and Autumn Korean-style sexy female high-heeled shoes fine with pointed suede Diamond shoes black professional shoes Shoes (Black (general paragraph))","https://www.lazada.com.my/2017-spring-and-autumn-korean-style-sexy-female-high-heeled-shoes-fine-with-pointed-suede-diamond-shoes-black-professional-shoes-shoes-black-general-paragraph-73950090.html?ff=1&sc=IYsE","",""
"","","English Color Word card English flash cards large card wild animal
Class 28 Zhang English children teacher teaching","https://www.lazada.com.my/english-color-word-card-english-flash-cards-large-card-wild-animalclass-28-zhang-english-children-teacher-teaching-41901266.html?ff=1&sc=IYsE","4","https://www.lazada.com.my/taobao-collection/?page=4&sc=IYsE"
"","","Non-toxic wooden bead toys for baby Taobao","https://www.lazada.com.my/non-toxic-wooden-bead-toys-for-baby-taobao-51055187.html?ff=1&sc=IYsE","1","https://www.lazada.com.my/taobao-collection/?sc=IYsE"
"","","Korean-style autumn young Slim fit jacket coat (Solid color-black) (Solid color-black)","https://www.lazada.com.my/korean-style-autumn-young-slim-fit-jacket-coat-solid-color-black-solid-color-black-73943203.html?ff=1&sc=IYsE","2","https://www.lazada.com.my/taobao-collection/?page=2&sc=IYsE"
"","","Original SD to CF card sets support Wireless WiFi SD card type
I-type adapter is SLR camera card","https://www.lazada.com.my/original-sd-to-cf-card-sets-support-wireless-wifi-sd-card-typei-type-adapter-is-slr-camera-card-88016424.html?ff=1&sc=IYsE","32959","https://www.lazada.com.my/taobao-collection/?page=32959&sc=IYsE"
"","","Cat cage three layer double four layer cat Villa large folding
encryption cat cage small cat Long cat pet cage","https://www.lazada.com.my/cat-cage-three-layer-double-four-layer-cat-villa-large-foldingencryption-cat-cage-small-cat-long-cat-pet-cage-87141296.html?ff=1&sc=IYsE","",""
"","","2017 spring and autumn canvas shoes women shoes wild street shooting white shoes spring Korean-style casual flat student shoes (A76 blue)","https://www.lazada.com.my/2017-spring-and-autumn-canvas-shoes-women-shoes-wild-street-shooting-white-shoes-spring-korean-style-casual-flat-student-shoes-a76-blue-88045189.html?ff=1&sc=IYsE","1","https://www.lazada.com.my/taobao-collection/?sc=IYsE"
"","","Flat with pointed hollow shoes hole shoes (Beige) (Beige)","https://www.lazada.com.my/flat-with-pointed-hollow-shoes-hole-shoes-beige-beige-51192136.html?ff=1&sc=IYsE","",""
"","","Pet Supplies pet nest dogs and cats house nest small pet nest can
be cleaning quality good price low a piece free shipping","https://www.lazada.com.my/pet-supplies-pet-nest-dogs-and-cats-house-nest-small-pet-nest-canbe-cleaning-quality-good-price-low-a-piece-free-shipping-87180011.html?ff=1&sc=IYsE","2","https://www.lazada.com.my/taobao-collection/?page=2&sc=IYsE"
"","","Adult feather velvet health care single to shoot 2 Care cervical
pillow","https://www.lazada.com.my/adult-feather-velvet-health-care-single-to-shoot-2-care-cervicalpillow-62143149.html?ff=1&sc=IYsE","4","https://www.lazada.com.my/taobao-collection/?page=4&sc=IYsE"
"","","Cartoon big packs children's rubber rub Rubber","https://www.lazada.com.my/cartoon-big-packs-children39s-rubber-rub-rubber-72223835.html?ff=1&sc=IYsE","1","https://www.lazada.com.my/taobao-collection/?sc=IYsE"
"","","Cartoon big packs children's rubber rub Rubber","https://www.lazada.com.my/cartoon-big-packs-children39s-rubber-rub-rubber-72223835.html?ff=1&sc=IYsE","",""
"","","Spring and Autumn and autumn New style Korean-style breathable
canvas shoes white shoes flat shoes a pedal to help low casual
shoes female shoes (A8 white)","https://www.lazada.com.my/spring-and-autumn-and-autumn-new-style-korean-style-breathablecanvas-shoes-white-shoes-flat-shoes-a-pedal-to-help-low-casualshoes-female-shoes-a8-white-88045164.html?ff=1&sc=IYsE","",""
"","","Storage rack long 75 wide 40 kitchen shelf floor Microwave Oven
Storage rack stainless steel color kitchen shelf","https://www.lazada.com.my/storage-rack-long-75-wide-40-kitchen-shelf-floor-microwave-ovenstorage-rack-stainless-steel-color-kitchen-shelf-82663172.html?ff=1&sc=IYsE","2","https://www.lazada.com.my/taobao-collection/?page=2&sc=IYsE"
"","","Retro female long-sleeved women heattech Top (122 * more casual)","https://www.lazada.com.my/retro-female-long-sleeved-women-heattech-top-122-more-casual-96055217.html?ff=1&sc=IYsE","3","https://www.lazada.com.my/taobao-collection/?page=3&sc=IYsE"
"","","Simple Solid color bedroom living room blackout curtains half-curtain","https://www.lazada.com.my/simple-solid-color-bedroom-living-room-blackout-curtains-half-curtain-58168476.html?ff=1&sc=IYsE","",""
"","","Baby stitching T-shirt 2017 spring Korean-style New style boy children's clothing children's casual long-sleeved shirt bottoming tx-7600 (Navy blue)","https://www.lazada.com.my/baby-stitching-t-shirt-2017-spring-korean-style-new-style-boy-children39s-clothing-children39s-casual-long-sleeved-shirt-bottoming-tx-7600-navy-blue-47350259.html?ff=1&sc=IYsE","4","https://www.lazada.com.my/taobao-collection/?page=4&sc=IYsE"
"","","C-NEX adapter ring movie lens CCTV lens to Sony NEX6/NEX5R/A5000","https://www.lazada.com.my/c-nex-adapter-ring-movie-lens-cctv-lens-to-sony-nex6nex5ra5000-41315018.html?ff=1&sc=IYsE","32959","https://www.lazada.com.my/taobao-collection/?page=32959&sc=IYsE"
"","","Week notepad business work day notes cute message stickers","https://www.lazada.com.my/week-notepad-business-work-day-notes-cute-message-stickers-70356407.html?ff=1&sc=IYsE","2","https://www.lazada.com.my/taobao-collection/?page=2&sc=IYsE"
"","","Fall Fashion shoes New style casual shoes (The NEW d-2 black)","https://www.lazada.com.my/fall-fashion-shoes-new-style-casual-shoes-the-new-d-2-black-51227265.html?ff=1&sc=IYsE","",""
"","","8 hook kitchen cabinet bottom with rack free nail wardrobe hangers
kitchen creative storage bearing hook shelf rack hook","https://www.lazada.com.my/8-hook-kitchen-cabinet-bottom-with-rack-free-nail-wardrobe-hangerskitchen-creative-storage-bearing-hook-shelf-rack-hook-82671467.html?ff=1&sc=IYsE","4","https://www.lazada.com.my/taobao-collection/?page=4&sc=IYsE"
"","","Art Linen loose casual pants trousers (White) (White)","https://www.lazada.com.my/art-linen-loose-casual-pants-trousers-white-white-43643815.html?ff=1&sc=IYsE","32959","https://www.lazada.com.my/taobao-collection/?page=32959&sc=IYsE"
"","","Kelly Korean-style canvas female New style messenger bag (Theme small)","https://www.lazada.com.my/kelly-korean-style-canvas-female-new-style-messenger-bag-theme-small-98341132.html?ff=1&sc=IYsE","3","https://www.lazada.com.my/taobao-collection/?page=3&sc=IYsE"
"","","Shelving rack microwave oven rack storage rack shelf kitchen
supplies room","https://www.lazada.com.my/shelving-rack-microwave-oven-rack-storage-rack-shelf-kitchensupplies-room-90687507.html?ff=1&sc=IYsE","1","https://www.lazada.com.my/taobao-collection/?sc=IYsE"
"","","Multi-function wrought iron pot rack multi-shelf put lid the rack kitchen cutting board Rack Cutting board storage rack","https://www.lazada.com.my/multi-function-wrought-iron-pot-rack-multi-shelf-put-lid-the-rack-kitchen-cutting-board-rack-cutting-board-storage-rack-81115568.html?ff=1&sc=IYsE","5","https://www.lazada.com.my/taobao-collection/?page=5&sc=IYsE"
